number,value,datetime_start,datetime_complete,duration,params_activation_decoder,params_activation_encoder,params_batch_size,params_dropout_rate,params_hidden_units,params_latent_dim,params_learning_rate,params_n_hidden_layers,state
0,0.12282408028841019,2026-07-28 17:10:30.037823,2026-07-28 17:10:37.159329,0 days 00:00:07.121506,linear,relu,128,0.1,32,16,0.01,3,COMPLETE
1,0.07871512323617935,2026-07-28 17:10:37.160133,2026-07-28 17:10:45.907376,0 days 00:00:08.747243,sigmoid,tanh,256,0.2,32,64,0.0005,1,COMPLETE
2,0.09429120272397995,2026-07-28 17:10:45.908185,2026-07-28 17:11:17.557549,0 days 00:00:31.649364,sigmoid,tanh,32,0.0,64,8,0.0001,1,COMPLETE
3,0.127231627702713,2026-07-28 17:11:17.558097,2026-07-28 17:11:41.670484,0 days 00:00:24.112387,sigmoid,tanh,256,0.1,128,8,0.0001,2,COMPLETE
4,0.02178943157196045,2026-07-28 17:11:41.671102,2026-07-28 17:12:01.429964,0 days 00:00:19.758862,sigmoid,tanh,128,0.0,128,128,0.01,2,COMPLETE
5,0.08977895975112915,2026-07-28 17:12:01.431496,2026-07-28 17:12:20.107166,0 days 00:00:18.675670,relu,relu,64,0.3,64,32,0.005,2,COMPLETE
6,0.05948331952095032,2026-07-28 17:12:20.107686,2026-07-28 17:12:33.629743,0 days 00:00:13.522057,relu,tanh,32,0.0,32,8,0.01,2,COMPLETE
7,0.0942329615354538,2026-07-28 17:12:33.636101,2026-07-28 17:12:53.806618,0 days 00:00:20.170517,sigmoid,relu,128,0.0,64,128,0.0001,3,COMPLETE
8,0.0034284316934645176,2026-07-28 17:12:53.808406,2026-07-28 17:13:16.009402,0 days 00:00:22.200996,relu,relu,64,0.0,128,16,0.001,2,COMPLETE
9,0.11592385172843933,2026-07-28 17:13:16.009820,2026-07-28 17:13:36.881947,0 days 00:00:20.872127,relu,relu,32,0.3,16,32,0.0001,1,COMPLETE
10,0.04789019748568535,2026-07-28 17:13:36.882681,2026-07-28 17:13:55.238315,0 days 00:00:18.355634,linear,relu,64,0.2,128,16,0.001,2,COMPLETE
11,0.003607415594160557,2026-07-28 17:13:55.238700,2026-07-28 17:14:06.054702,0 days 00:00:10.816002,relu,tanh,128,0.0,128,128,0.001,2,COMPLETE
12,0.003348889062181115,2026-07-28 17:14:06.057827,2026-07-28 17:14:33.736802,0 days 00:00:27.678975,relu,tanh,64,0.0,128,128,0.001,2,COMPLETE
13,0.0043264152482151985,2026-07-28 17:14:33.737687,2026-07-28 17:14:54.897397,0 days 00:00:21.159710,relu,relu,64,0.0,128,16,0.001,2,COMPLETE
14,0.037953492254018784,2026-07-28 17:14:54.897801,2026-07-28 17:15:10.515783,0 days 00:00:15.617982,relu,tanh,64,0.0,16,64,0.001,2,COMPLETE
15,0.012581721879541874,2026-07-28 17:15:10.517557,2026-07-28 17:15:28.638688,0 days 00:00:18.121131,relu,relu,64,0.0,128,128,0.001,3,COMPLETE
16,0.04488649591803551,2026-07-28 17:15:28.639164,2026-07-28 17:15:43.406613,0 days 00:00:14.767449,linear,relu,64,0.2,128,16,0.0005,2,COMPLETE
17,0.046162303537130356,2026-07-28 17:15:43.407020,2026-07-28 17:16:02.088082,0 days 00:00:18.681062,relu,tanh,64,0.3,128,16,0.005,2,COMPLETE
18,0.04840400069952011,2026-07-28 17:16:02.088546,2026-07-28 17:16:14.559048,0 days 00:00:12.470502,relu,tanh,64,0.1,16,128,0.001,1,COMPLETE
19,0.004858067724853754,2026-07-28 17:16:14.560455,2026-07-28 17:16:27.251268,0 days 00:00:12.690813,relu,relu,256,0.0,128,64,0.001,3,COMPLETE
20,0.038733888417482376,2026-07-28 17:16:27.252599,2026-07-28 17:16:41.657536,0 days 00:00:14.404937,linear,relu,64,0.0,128,16,0.001,2,COMPLETE
21,0.002564140362665057,2026-07-28 17:16:41.657912,2026-07-28 17:17:05.271684,0 days 00:00:23.613772,relu,tanh,64,0.0,128,128,0.001,2,COMPLETE
22,0.0026770206168293953,2026-07-28 17:17:05.272137,2026-07-28 17:17:27.780028,0 days 00:00:22.507891,relu,tanh,64,0.0,128,128,0.001,2,COMPLETE
23,0.0037458273582160473,2026-07-28 17:17:27.781472,2026-07-28 17:17:40.429716,0 days 00:00:12.648244,relu,tanh,64,0.0,128,128,0.001,2,COMPLETE
24,0.0017446075798943639,2026-07-28 17:17:40.430262,2026-07-28 17:18:05.095450,0 days 00:00:24.665188,relu,tanh,64,0.0,128,128,0.0005,2,COMPLETE
25,0.0019721968565136194,2026-07-28 17:18:05.096954,2026-07-28 17:18:27.868653,0 days 00:00:22.771699,relu,tanh,64,0.0,128,128,0.0005,2,COMPLETE
26,0.05295881628990173,2026-07-28 17:18:27.870240,2026-07-28 17:18:42.147777,0 days 00:00:14.277537,relu,tanh,64,0.2,32,128,0.0005,2,COMPLETE
27,0.02135651744902134,2026-07-28 17:18:42.148169,2026-07-28 17:18:49.680724,0 days 00:00:07.532555,relu,tanh,256,0.3,64,128,0.0005,1,COMPLETE
28,0.0902632474899292,2026-07-28 17:18:49.681127,2026-07-28 17:19:16.542283,0 days 00:00:26.861156,relu,tanh,32,0.1,16,128,0.0005,3,COMPLETE
29,0.045870404690504074,2026-07-28 17:19:16.542659,2026-07-28 17:19:25.608361,0 days 00:00:09.065702,linear,tanh,128,0.1,32,32,0.0005,2,COMPLETE
30,0.0026522153057157993,2026-07-28 17:19:25.608802,2026-07-28 17:19:49.509019,0 days 00:00:23.900217,linear,tanh,64,0.0,128,128,0.0005,3,COMPLETE
31,0.006723583210259676,2026-07-28 17:19:49.510497,2026-07-28 17:19:59.250425,0 days 00:00:09.739928,linear,tanh,64,0.0,128,128,0.0005,3,COMPLETE
32,0.0038689884822815657,2026-07-28 17:19:59.250823,2026-07-28 17:20:26.190584,0 days 00:00:26.939761,linear,tanh,64,0.0,128,128,0.0005,3,COMPLETE
33,0.00710136815905571,2026-07-28 17:20:26.192104,2026-07-28 17:20:38.706795,0 days 00:00:12.514691,linear,tanh,64,0.0,128,128,0.0005,3,COMPLETE
34,0.003468738868832588,2026-07-28 17:20:38.708486,2026-07-28 17:20:54.289773,0 days 00:00:15.581287,linear,tanh,256,0.0,128,64,0.0005,3,COMPLETE
35,0.032972302287817,2026-07-28 17:20:54.290654,2026-07-28 17:21:05.462653,0 days 00:00:11.171999,sigmoid,tanh,64,0.0,32,8,0.01,1,COMPLETE
36,0.08162648230791092,2026-07-28 17:21:05.463028,2026-07-28 17:21:30.264058,0 days 00:00:24.801030,sigmoid,tanh,32,0.2,64,128,0.005,3,COMPLETE
37,0.0024303679820150137,2026-07-28 17:21:30.264460,2026-07-28 17:21:51.511552,0 days 00:00:21.247092,linear,tanh,64,0.0,128,128,0.0005,2,COMPLETE
38,0.006483605597168207,2026-07-28 17:21:51.511946,2026-07-28 17:22:08.325156,0 days 00:00:16.813210,relu,tanh,128,0.1,128,32,0.0005,2,COMPLETE
39,0.02541484124958515,2026-07-28 17:22:08.325557,2026-07-28 17:22:15.710279,0 days 00:00:07.384722,sigmoid,tanh,256,0.0,64,8,0.01,2,COMPLETE
40,0.018918072804808617,2026-07-28 17:22:15.712068,2026-07-28 17:22:41.679525,0 days 00:00:25.967457,relu,tanh,64,0.3,128,128,0.0001,2,COMPLETE
41,0.002400453668087721,2026-07-28 17:22:41.680070,2026-07-28 17:23:06.154837,0 days 00:00:24.474767,linear,tanh,64,0.0,128,128,0.0005,2,COMPLETE
42,0.0029261417221277952,2026-07-28 17:23:06.156575,2026-07-28 17:23:29.448327,0 days 00:00:23.291752,linear,tanh,64,0.0,128,128,0.0005,2,COMPLETE
43,0.004532623570412397,2026-07-28 17:23:29.448729,2026-07-28 17:23:42.556340,0 days 00:00:13.107611,linear,tanh,64,0.0,128,128,0.0005,2,COMPLETE
44,0.0027257571928203106,2026-07-28 17:23:42.557172,2026-07-28 17:24:05.953637,0 days 00:00:23.396465,linear,tanh,64,0.0,128,128,0.0005,2,COMPLETE
45,0.04723795875906944,2026-07-28 17:24:05.954060,2026-07-28 17:24:15.909699,0 days 00:00:09.955639,linear,tanh,32,0.0,128,128,0.005,2,COMPLETE
46,0.049709197133779526,2026-07-28 17:24:15.910111,2026-07-28 17:24:28.341081,0 days 00:00:12.430970,relu,tanh,64,0.0,32,8,0.0001,2,COMPLETE
47,0.09623946249485016,2026-07-28 17:24:28.341496,2026-07-28 17:24:36.528566,0 days 00:00:08.187070,sigmoid,tanh,128,0.0,16,128,0.0005,2,COMPLETE
48,0.06829389929771423,2026-07-28 17:24:36.528955,2026-07-28 17:24:58.022507,0 days 00:00:21.493552,relu,tanh,64,0.2,128,32,0.01,2,COMPLETE
49,0.004817647859454155,2026-07-28 17:24:58.023295,2026-07-28 17:25:10.042301,0 days 00:00:12.019006,linear,tanh,64,0.0,128,64,0.0005,2,COMPLETE
