number,value,datetime_start,datetime_complete,duration,params_activation,params_batch_size,params_dropout_rate,params_hidden_units,params_latent_dim,params_learning_rate,params_n_hidden_layers,state
0,0.1450357586145401,2026-07-28 16:54:01.795155,2026-07-28 16:54:13.185569,0 days 00:00:11.390414,relu,128,0.2,32,8,0.0001,3,COMPLETE
1,0.027647433802485466,2026-07-28 16:54:13.185981,2026-07-28 16:54:39.069755,0 days 00:00:25.883774,sigmoid,32,0.3,64,128,0.01,1,COMPLETE
2,0.038851719349622726,2026-07-28 16:54:39.074721,2026-07-28 16:54:52.817508,0 days 00:00:13.742787,sigmoid,128,0.1,64,128,0.005,2,COMPLETE
3,0.143672913312912,2026-07-28 16:54:52.817892,2026-07-28 16:55:00.946036,0 days 00:00:08.128144,relu,256,0.3,32,32,0.001,3,COMPLETE
4,0.11305057257413864,2026-07-28 16:55:00.946843,2026-07-28 16:55:07.943177,0 days 00:00:06.996334,tanh,128,0.2,16,16,0.0001,1,COMPLETE
5,0.1320478320121765,2026-07-28 16:55:07.943571,2026-07-28 16:55:21.343827,0 days 00:00:13.400256,sigmoid,256,0.3,128,64,0.0001,1,COMPLETE
6,0.04184771329164505,2026-07-28 16:55:21.346311,2026-07-28 16:55:28.596939,0 days 00:00:07.250628,sigmoid,128,0.0,16,64,0.01,1,COMPLETE
7,0.053375087678432465,2026-07-28 16:55:28.597371,2026-07-28 16:55:33.555316,0 days 00:00:04.957945,relu,256,0.0,16,16,0.0005,2,COMPLETE
8,0.04050322622060776,2026-07-28 16:55:33.555679,2026-07-28 16:55:37.127895,0 days 00:00:03.572216,relu,128,0.1,32,64,0.01,1,COMPLETE
9,0.1468413770198822,2026-07-28 16:55:37.128341,2026-07-28 16:55:59.436540,0 days 00:00:22.308199,sigmoid,32,0.2,16,128,0.0001,1,COMPLETE
10,0.11861077696084976,2026-07-28 16:55:59.442206,2026-07-28 16:56:10.137066,0 days 00:00:10.694860,tanh,32,0.3,64,128,0.01,2,COMPLETE
11,0.031891632825136185,2026-07-28 16:56:10.137816,2026-07-28 16:56:28.737010,0 days 00:00:18.599194,sigmoid,64,0.1,64,128,0.005,2,COMPLETE
12,0.03382501006126404,2026-07-28 16:56:28.737415,2026-07-28 16:56:47.257090,0 days 00:00:18.519675,sigmoid,64,0.1,64,128,0.005,2,COMPLETE
13,0.02562236785888672,2026-07-28 16:56:47.258729,2026-07-28 16:57:05.520327,0 days 00:00:18.261598,sigmoid,64,0.1,64,128,0.005,2,COMPLETE
14,0.15410348773002625,2026-07-28 16:57:05.520750,2026-07-28 16:57:26.239611,0 days 00:00:20.718861,sigmoid,64,0.3,64,32,0.0005,3,COMPLETE
15,0.021484119817614555,2026-07-28 16:57:26.240150,2026-07-28 16:57:51.691804,0 days 00:00:25.451654,sigmoid,32,0.1,128,8,0.001,1,COMPLETE
16,0.029397694393992424,2026-07-28 16:57:51.692479,2026-07-28 16:58:25.187502,0 days 00:00:33.495023,tanh,32,0.1,128,8,0.001,2,COMPLETE
17,0.05248834192752838,2026-07-28 16:58:25.187971,2026-07-28 16:58:47.476983,0 days 00:00:22.289012,sigmoid,64,0.1,128,8,0.001,2,COMPLETE
18,0.03111114166676998,2026-07-28 16:58:47.477679,2026-07-28 16:59:03.505461,0 days 00:00:16.027782,sigmoid,64,0.1,128,8,0.001,1,COMPLETE
19,0.09464413672685623,2026-07-28 16:59:03.506241,2026-07-28 16:59:21.289121,0 days 00:00:17.782880,tanh,32,0.1,128,8,0.005,3,COMPLETE
20,0.007573656737804413,2026-07-28 16:59:21.289701,2026-07-28 16:59:52.576306,0 days 00:00:31.286605,sigmoid,32,0.0,128,32,0.001,2,COMPLETE
21,0.01103946566581726,2026-07-28 16:59:52.577808,2026-07-28 17:00:27.108558,0 days 00:00:34.530750,sigmoid,32,0.0,128,32,0.001,2,COMPLETE
22,0.007166579831391573,2026-07-28 17:00:27.118304,2026-07-28 17:01:00.334845,0 days 00:00:33.216541,sigmoid,32,0.0,128,32,0.001,2,COMPLETE
23,0.0072584026493132114,2026-07-28 17:01:00.336617,2026-07-28 17:01:39.963958,0 days 00:00:39.627341,sigmoid,32,0.0,128,32,0.001,2,COMPLETE
24,0.007746380288153887,2026-07-28 17:01:39.971063,2026-07-28 17:02:16.940006,0 days 00:00:36.968943,sigmoid,32,0.0,128,32,0.001,2,COMPLETE
25,0.0075782956555485725,2026-07-28 17:02:16.942096,2026-07-28 17:02:51.047329,0 days 00:00:34.105233,sigmoid,32,0.0,128,32,0.001,2,COMPLETE
26,0.0064042313024401665,2026-07-28 17:02:51.048858,2026-07-28 17:03:24.031540,0 days 00:00:32.982682,sigmoid,32,0.0,128,32,0.001,2,COMPLETE
27,0.006551399827003479,2026-07-28 17:03:24.033092,2026-07-28 17:03:55.688154,0 days 00:00:31.655062,sigmoid,32,0.0,128,32,0.001,2,COMPLETE
28,0.004949552938342094,2026-07-28 17:03:55.689630,2026-07-28 17:04:27.294848,0 days 00:00:31.605218,tanh,32,0.0,128,32,0.001,2,COMPLETE
29,0.019272027537226677,2026-07-28 17:04:27.296361,2026-07-28 17:04:56.198631,0 days 00:00:28.902270,tanh,32,0.0,32,32,0.0005,3,COMPLETE
30,0.004541412461549044,2026-07-28 17:04:56.200449,2026-07-28 17:05:24.542911,0 days 00:00:28.342462,tanh,32,0.0,128,32,0.001,2,COMPLETE
31,0.004082455299794674,2026-07-28 17:05:24.544560,2026-07-28 17:05:58.330575,0 days 00:00:33.786015,tanh,32,0.0,128,32,0.001,2,COMPLETE
32,0.00414955522865057,2026-07-28 17:05:58.332200,2026-07-28 17:06:28.784850,0 days 00:00:30.452650,tanh,32,0.0,128,32,0.001,2,COMPLETE
33,0.005401641130447388,2026-07-28 17:06:28.785230,2026-07-28 17:06:54.255603,0 days 00:00:25.470373,tanh,32,0.0,128,32,0.001,2,COMPLETE
34,0.005764347035437822,2026-07-28 17:06:54.257117,2026-07-28 17:07:10.634006,0 days 00:00:16.376889,tanh,32,0.0,128,32,0.001,2,COMPLETE
35,0.08390805870294571,2026-07-28 17:07:10.634379,2026-07-28 17:07:17.154546,0 days 00:00:06.520167,tanh,256,0.2,32,16,0.001,2,COMPLETE
36,0.004375970922410488,2026-07-28 17:07:17.154931,2026-07-28 17:08:08.155413,0 days 00:00:51.000482,tanh,32,0.0,128,32,0.0001,3,COMPLETE
37,0.012481077574193478,2026-07-28 17:08:08.158191,2026-07-28 17:08:40.361023,0 days 00:00:32.202832,tanh,128,0.0,128,32,0.0001,3,COMPLETE
38,0.11273939162492752,2026-07-28 17:08:40.362920,2026-07-28 17:08:47.852066,0 days 00:00:07.489146,tanh,256,0.0,16,64,0.0001,3,COMPLETE
39,0.11000894755125046,2026-07-28 17:08:47.852531,2026-07-28 17:09:31.534176,0 days 00:00:43.681645,tanh,32,0.2,32,16,0.0001,3,COMPLETE
40,0.004516249988228083,2026-07-28 17:09:31.536027,2026-07-28 17:09:53.873654,0 days 00:00:22.337627,relu,128,0.0,128,32,0.0001,3,COMPLETE
41,0.004347148817032576,2026-07-28 17:09:53.874625,2026-07-28 17:10:14.373057,0 days 00:00:20.498432,relu,128,0.0,128,32,0.0001,3,COMPLETE
42,0.004269820172339678,2026-07-28 17:10:14.373525,2026-07-28 17:10:35.752866,0 days 00:00:21.379341,relu,128,0.0,128,32,0.0001,3,COMPLETE
43,0.00461040623486042,2026-07-28 17:10:35.756318,2026-07-28 17:11:01.744310,0 days 00:00:25.987992,relu,128,0.0,128,32,0.0001,3,COMPLETE
44,0.2001609057188034,2026-07-28 17:11:01.744802,2026-07-28 17:11:15.000110,0 days 00:00:13.255308,relu,128,0.3,16,64,0.0001,3,COMPLETE
45,0.004097106866538525,2026-07-28 17:11:15.000557,2026-07-28 17:11:42.794218,0 days 00:00:27.793661,relu,128,0.0,128,32,0.0001,3,COMPLETE
46,0.038103219121694565,2026-07-28 17:11:42.796300,2026-07-28 17:12:20.452965,0 days 00:00:37.656665,relu,128,0.2,128,32,0.0001,3,COMPLETE
47,0.07901382446289062,2026-07-28 17:12:20.453486,2026-07-28 17:12:29.175413,0 days 00:00:08.721927,relu,128,0.0,128,16,0.01,3,COMPLETE
48,0.21347728371620178,2026-07-28 17:12:29.177886,2026-07-28 17:12:43.610375,0 days 00:00:14.432489,relu,128,0.3,16,32,0.0001,3,COMPLETE
49,0.01224789023399353,2026-07-28 17:12:43.615880,2026-07-28 17:13:00.370498,0 days 00:00:16.754618,relu,128,0.0,64,32,0.0001,3,COMPLETE
